{
  "adapter": {
    "head": "aaaaaaaaaaaaaaaaaaaaaaaaaaaaaaaaaaaaaaaa",
    "private_runtime_label": "fp-hosted-replay-jit-v1",
    "repository": "fawxzzy/hosted-replay-harness",
    "tree": "bbbbbbbbbbbbbbbbbbbbbbbbbbbbbbbbbbbbbbbb",
    "workflow": ".github/workflows/fitness-full-chain-replay.yml"
  },
  "cleanup": {
    "attempted": true,
    "containers_remaining": 0,
    "foreign_objects_touched": 0,
    "listeners_remaining": 0,
    "networks_remaining": 0,
    "runtime_residue_count": 0,
    "source_entries_remaining": 0,
    "succeeded": true,
    "volumes_remaining": 0
  },
  "containment": {
    "external_dns_failed": true,
    "host_failed": true,
    "host_publication_count": 0,
    "literal_ip_failed": true,
    "metadata_failed": true,
    "no_default_route": true,
    "private_docker_socket": true,
    "provider_contact_count": 0,
    "registry_failed": true,
    "runtime_attested": true,
    "same_network": true
  },
  "failure_class": "NONE",
  "fixtures": {
    "automation_null": true,
    "concurrent_distinct": true,
    "concurrent_max": 13,
    "concurrent_min": 6,
    "concurrent_requested": 8,
    "concurrent_succeeded": 8,
    "deleted_gap_preserved": true,
    "deleted_label": "human-003",
    "effective_next": 14,
    "initial_automations": 1,
    "initial_humans": 6,
    "mapping_after_delete_sha256": "03d36cc7bfacd1d0fb985bcb35b8fe8307deb9936e37daa3c1efdd7471d22bfe",
    "mapping_before_sha256": "232158a043e46fa000d796ee306a0c4fae7dedf7cfa8e70d90abbe6fa59f1848",
    "mapping_final_sha256": "f74ca037a456306b77cccaa5059a059066ea68f29e862d662ad60e056e06e6ad",
    "post_high_water": 13,
    "prior_high_water": 5
  },
  "migrations": {
    "candidate_applied_count": 1,
    "idempotency_rerun": true,
    "ordered_count": 102,
    "records": [
      {
        "applied": true,
        "duration_ms": 1,
        "ordinal": 1,
        "path": "supabase/migrations/001_init.sql",
        "sha256": "d4b0fd3f945a6caa979d280709af9138e384e67c27f3c37ae0307af111e5a88d"
      },
      {
        "applied": true,
        "duration_ms": 1,
        "ordinal": 2,
        "path": "supabase/migrations/002_routines.sql",
        "sha256": "7eed5d0745a7d43618daf118e6e5d352f89f900e7125b96a5751587e51c74cef"
      },
      {
        "applied": true,
        "duration_ms": 1,
        "ordinal": 3,
        "path": "supabase/migrations/003_sets_reps_history.sql",
        "sha256": "d0cd5463502aebb400a4419b16e76d00bae98b328159a260b2d4ec84e6ab70d2"
      },
      {
        "applied": true,
        "duration_ms": 1,
        "ordinal": 4,
        "path": "supabase/migrations/004_timers.sql",
        "sha256": "6e4b2dea73d4634a09ed59b10a8ce4c71fd377b7bdab8326323ed481e50e02a8"
      },
      {
        "applied": true,
        "duration_ms": 1,
        "ordinal": 5,
        "path": "supabase/migrations/005_ui_core_fix_pack.sql",
        "sha256": "cbe4a50db76cde4386c9d57105addddc1c4301977cb8ec88f62459fb8b46bb44"
      },
      {
        "applied": true,
        "duration_ms": 1,
        "ordinal": 6,
        "path": "supabase/migrations/006_session_status.sql",
        "sha256": "6ef3c574c34e349ad3a5c367ab159e1004f15165b100341f2db32b2a656f69c1"
      },
      {
        "applied": true,
        "duration_ms": 1,
        "ordinal": 7,
        "path": "supabase/migrations/007_relax_rep_range_constraint.sql",
        "sha256": "602443c368bbd4e2ba5990bfd35dbdfdd596814ff774ae43ce20be4f3bb66c8e"
      },
      {
        "applied": true,
        "duration_ms": 1,
        "ordinal": 8,
        "path": "supabase/migrations/008_exercises_table_and_rls.sql",
        "sha256": "10b80cac3fc490c3060969ddfc72e23cebf92ecc343b5312621f6a151dae93fa"
      },
      {
        "applied": true,
        "duration_ms": 1,
        "ordinal": 9,
        "path": "supabase/migrations/009_seed_global_exercises.sql",
        "sha256": "db4b6e19fad38769d17c3ad330cca946023b784d80200aeff710a6c5d1d5fdc2"
      },
      {
        "applied": true,
        "duration_ms": 1,
        "ordinal": 10,
        "path": "supabase/migrations/010_routine_targets_weight_duration.sql",
        "sha256": "cbb358e2939e845ac37f01823d7efc53257627911c31221614db82bb0ed6634b"
      },
      {
        "applied": true,
        "duration_ms": 1,
        "ordinal": 11,
        "path": "supabase/migrations/011_exercises_id_uuid_backfill.sql",
        "sha256": "938d7c1011518c003b1843a852ea2823375de1145b52645db605602aba1a5908"
      },
      {
        "applied": true,
        "duration_ms": 1,
        "ordinal": 12,
        "path": "supabase/migrations/012_fix_exercises_id_nulls_constraints.sql",
        "sha256": "a20592afb339f6bf768929e009ec00cc64a256029afebc7be54885e79e6402d1"
      },
      {
        "applied": true,
        "duration_ms": 1,
        "ordinal": 13,
        "path": "supabase/migrations/013_sets_session_exercise_set_index_unique.sql",
        "sha256": "337b497a7b309298ea6db168cae0857094b9125e5d4a7cf3f91fad7ce9777a61"
      },
      {
        "applied": true,
        "duration_ms": 1,
        "ordinal": 14,
        "path": "supabase/migrations/014_sets_client_log_id_unique.sql",
        "sha256": "de8c46fc23efc77d94aeb678e7559f7f67f483347e5a7b71be055667c93071db"
      },
      {
        "applied": true,
        "duration_ms": 1,
        "ordinal": 15,
        "path": "supabase/migrations/015_history_log_audit_notes.sql",
        "sha256": "9d0552194e500faa47300756794f821fb6f18162d55371f0550884133fdf3058"
      },
      {
        "applied": true,
        "duration_ms": 1,
        "ordinal": 16,
        "path": "supabase/migrations/016_weight_unit_overrides.sql",
        "sha256": "ce5e69601a85a25d0eb8375b108af392d57da0b556c4b9a6490c40de70b5aee7"
      },
      {
        "applied": true,
        "duration_ms": 1,
        "ordinal": 17,
        "path": "supabase/migrations/017_exercise_media_and_metadata.sql",
        "sha256": "f9b6345b02b9ce2e08b7fac5ba69a0e38262587c54ff1247c6e510d027e6f28f"
      },
      {
        "applied": true,
        "duration_ms": 1,
        "ordinal": 18,
        "path": "supabase/migrations/018_chest_press_seed_variants.sql",
        "sha256": "d4d6a743f4f10f54f7a6fdcbc4397780b39fdadba2207b9bee87e6f8a60964d8"
      },
      {
        "applied": true,
        "duration_ms": 1,
        "ordinal": 19,
        "path": "supabase/migrations/019_exercise_metadata_defaults_and_constraints.sql",
        "sha256": "46eb40949a5deb1227a370cd87b6b2a85d171b88daf5cd3c5f4cf0fe5deb00fd"
      },
      {
        "applied": true,
        "duration_ms": 1,
        "ordinal": 20,
        "path": "supabase/migrations/020_global_exercises_metadata_backfill.sql",
        "sha256": "e51a9af684cc2047392b5aa0986be269a2707162094800a0e29a3113601bcb46"
      },
      {
        "applied": true,
        "duration_ms": 1,
        "ordinal": 21,
        "path": "supabase/migrations/021_exercise_measurement_and_set_distance.sql",
        "sha256": "16881d2eff85c401ba6b821a0ecc489cbf02312a50dd810d3efcbd588352c521"
      },
      {
        "applied": true,
        "duration_ms": 1,
        "ordinal": 22,
        "path": "supabase/migrations/0221_routine_day_exercise_cardio_targets.sql",
        "sha256": "2fc9499be218c26564802cc94717f0e32efe6379311cef8d3baba20c1b638ab1"
      },
      {
        "applied": true,
        "duration_ms": 1,
        "ordinal": 23,
        "path": "supabase/migrations/0222_profile_unit_preferences.sql",
        "sha256": "4c9012eb90a4f7853188e067e64d53b94f3104c35a066a59f60d6b6ef34cc6a8"
      },
      {
        "applied": true,
        "duration_ms": 1,
        "ordinal": 24,
        "path": "supabase/migrations/023_routine_session_exercise_measurement_overrides.sql",
        "sha256": "68d69fd3212e06f258a8891a6f7e869bc907a8edc1433833e45a06a1cabfb9a0"
      },
      {
        "applied": true,
        "duration_ms": 1,
        "ordinal": 25,
        "path": "supabase/migrations/024_session_exercises_routine_day_exercise_fk.sql",
        "sha256": "b4c396146231e5a408ce4ea5f958a3c77e22a8aacfcab3a6ab800c3d04f59e76"
      },
      {
        "applied": true,
        "duration_ms": 1,
        "ordinal": 26,
        "path": "supabase/migrations/025_session_exercises_performed_index.sql",
        "sha256": "2069fc9544799e4d2d876a5b929ab3195622297e123a192d7efc39a10f72c3b7"
      },
      {
        "applied": true,
        "duration_ms": 1,
        "ordinal": 27,
        "path": "supabase/migrations/026_exercise_stats_cache.sql",
        "sha256": "3a932ce660894c73e75e5534f3090088ad9f2343bf831ecf3cdaecae91c5e534"
      },
      {
        "applied": true,
        "duration_ms": 1,
        "ordinal": 28,
        "path": "supabase/migrations/027_session_exercises_target_calories.sql",
        "sha256": "62353e5c7dec6de57ad425343159afbf0169334b0cd1dcda3f2421aa3013a45c"
      },
      {
        "applied": true,
        "duration_ms": 1,
        "ordinal": 29,
        "path": "supabase/migrations/028_session_exercises_goal_targets_consistency.sql",
        "sha256": "f65e70e1cc1f6e27479a59f28c4a371060193cee129e2b6a375cbc74d16792b9"
      },
      {
        "applied": true,
        "duration_ms": 1,
        "ordinal": 30,
        "path": "supabase/migrations/029_session_exercises_range_goal_columns.sql",
        "sha256": "3da9518f614be88e30ed87db82812c5605307e27949bf750c02f9c672c93fdca"
      },
      {
        "applied": true,
        "duration_ms": 1,
        "ordinal": 31,
        "path": "supabase/migrations/0301_session_exercises_target_sets_range_columns.sql",
        "sha256": "fc5150c341e11bdc637d2da54d2c23225ce0d365b4fc54e0ddb114ab41ee26ac"
      },
      {
        "applied": true,
        "duration_ms": 1,
        "ordinal": 32,
        "path": "supabase/migrations/0302_backfill_session_exercises_exercise_id.sql",
        "sha256": "39422dd05feb383d2eb7f1502eec1ea7957c1c6aedc81dcb858725206d5df28c"
      },
      {
        "applied": true,
        "duration_ms": 1,
        "ordinal": 33,